{"$schema":"https://json-schema.org/draft/2020-12/schema","$id":"https://dough.monster/contracts/preorder-configuration-v1.schema.json","type":"object","additionalProperties":false,"required":["schema_version","publication_ref","publication_mode","source_evidence","surface","pickup_policy","savings_policy","capacity_policy","feature_flags","catalog"],"properties":{"$schema":{"type":"string","minLength":1},"schema_version":{"const":1},"publication_ref":{"$ref":"#/$defs/uuid"},"publication_mode":{"enum":["draft","active"]},"source_evidence":{"type":"object","additionalProperties":false,"required":["source_system","menu_id","source_version_id","observed_at"],"properties":{"source_system":{"const":"toast"},"menu_id":{"$ref":"#/$defs/uuid"},"source_version_id":{"type":"string","pattern":"^[0-9a-f]{64}$"},"observed_at":{"type":"string","format":"date-time"}}},"surface":{"type":"object","additionalProperties":false,"required":["surface_id","surface_key","location_id","location_name","timezone","enabled","freshness_seconds","cancellation_policy"],"properties":{"surface_id":{"$ref":"#/$defs/uuid"},"surface_key":{"type":"string","pattern":"^[a-z][a-z0-9_-]{1,63}$"},"location_id":{"$ref":"#/$defs/uuid"},"location_name":{"type":"string","minLength":1,"maxLength":120},"timezone":{"type":"string","minLength":1,"maxLength":64},"enabled":{"type":"boolean"},"freshness_seconds":{"type":"integer","minimum":30,"maximum":3600},"cancellation_policy":{"type":"object","additionalProperties":false,"required":["summary","customer_cancellation_allowed","customer_modification_allowed"],"properties":{"summary":{"type":"string","maxLength":500},"customer_cancellation_allowed":{"type":"boolean"},"customer_modification_allowed":{"type":"boolean"}}}}},"pickup_policy":{"type":"object","additionalProperties":false,"required":["horizon_days","daily_start_local","daily_end_local","cutoff_hours","closures"],"properties":{"horizon_days":{"const":14},"daily_start_local":{"$ref":"#/$defs/localTime"},"daily_end_local":{"$ref":"#/$defs/localTime"},"cutoff_hours":{"type":["integer","null"],"minimum":0,"maximum":336},"closures":{"type":"array","uniqueItems":true,"items":{"type":"string","format":"date"}}}},"savings_policy":{"type":"object","additionalProperties":false,"required":["advance_tiers","quantity_levels"],"properties":{"advance_tiers":{"type":"array","minItems":3,"maxItems":3,"items":{"$ref":"#/$defs/advanceTier"}},"quantity_levels":{"type":"array","items":{"$ref":"#/$defs/quantityLevel"}}}},"capacity_policy":{"type":"object","additionalProperties":false,"required":["daily_limit","limited_threshold"],"properties":{"daily_limit":{"type":["integer","null"],"minimum":0},"limited_threshold":{"type":["integer","null"],"minimum":0}}},"feature_flags":{"type":"object","additionalProperties":{"type":"boolean"}},"catalog":{"type":"array","minItems":1,"items":{"$ref":"#/$defs/catalogItem"}}},"$defs":{"uuid":{"type":"string","format":"uuid"},"localTime":{"type":"string","pattern":"^(?:[01][0-9]|2[0-3]):[0-5][0-9]$"},"nullableMoney":{"type":["integer","null"],"minimum":0},"advanceTier":{"type":"object","additionalProperties":false,"required":["minimum_days","multiplier_bps"],"properties":{"minimum_days":{"enum":[2,5,10]},"multiplier_bps":{"type":["integer","null"],"minimum":0,"maximum":10000}}},"quantityLevel":{"type":"object","additionalProperties":false,"required":["minimum_quantity","discount_bps","label"],"properties":{"minimum_quantity":{"type":"integer","minimum":1},"discount_bps":{"type":["integer","null"],"minimum":0,"maximum":10000},"label":{"type":"string","minLength":1,"maxLength":80}}},"catalogItem":{"type":"object","additionalProperties":false,"required":["item_id","item_version","category","name","description","currency","shop_price_minor","preorder_price_minor","price_floor_minor","media","allergens","allergen_status","seasonal_eligibility","available","maximum_quantity","option_groups","disclosures"],"properties":{"item_id":{"$ref":"#/$defs/uuid"},"item_version":{"type":"integer","minimum":1},"category":{"type":"string","minLength":1,"maxLength":120},"name":{"type":"string","minLength":1,"maxLength":120},"description":{"type":"string","maxLength":1000},"currency":{"const":"USD"},"shop_price_minor":{"type":"integer","minimum":1},"preorder_price_minor":{"$ref":"#/$defs/nullableMoney"},"price_floor_minor":{"$ref":"#/$defs/nullableMoney"},"media":{"type":"array","items":{"type":"object"}},"allergens":{"type":"array","uniqueItems":true,"items":{"enum":["milk","egg","peanuts","tree_nuts","wheat","soy","sesame"]}},"allergen_status":{"enum":["verified","contains_declared","cross_contact_possible","unverified"]},"seasonal_eligibility":{"enum":["eligible","ineligible"]},"available":{"type":"boolean"},"maximum_quantity":{"type":"integer","minimum":0},"option_groups":{"type":"array"},"disclosures":{"type":"array","items":{"type":"string","maxLength":240}}}}}}
