{"$schema":"./preorder-configuration-v1.schema.json","schema_version":1,"publication_ref":"70000000-0000-4000-8000-000000000271","publication_mode":"draft","source_evidence":{"source_system":"toast","menu_id":"fb8d9bc6-42c5-4510-8679-541b363cf597","source_version_id":"629adfe1bee608dc06059de4a6b2f86e060c3c9e7bc15b045b6323cc30dfecd9","observed_at":"2026-07-28T20:00:31.912Z"},"surface":{"surface_id":"c0a79f53-70ca-4a6a-a413-59cfeaf2905d","surface_key":"preorder","location_id":"9154e81d-52a1-46ea-a213-e572343a601b","location_name":"Dough Monster","timezone":"America/New_York","enabled":false,"freshness_seconds":300,"cancellation_policy":{"summary":"Policy must be confirmed before first-party checkout is enabled.","customer_cancellation_allowed":false,"customer_modification_allowed":false}},"pickup_policy":{"horizon_days":14,"daily_start_local":"08:00","daily_end_local":"10:00","cutoff_hours":null,"closures":[]},"savings_policy":{"advance_tiers":[{"minimum_days":2,"multiplier_bps":null},{"minimum_days":5,"multiplier_bps":null},{"minimum_days":10,"multiplier_bps":null}],"quantity_levels":[]},"capacity_policy":{"daily_limit":null,"limited_threshold":null},"feature_flags":{"checkout":false,"customer_cancellation":false,"customer_modification":false},"catalog":[{"item_id":"d11f082b-e0ef-4d6e-9537-45111be658b9","item_version":1,"category":"Filled Doughnuts","name":"Vanilla Joe","description":"Espresso creme, vanilla buttercream, sanding sugar, and espresso powder.","currency":"USD","shop_price_minor":160,"preorder_price_minor":null,"price_floor_minor":null,"media":[],"allergens":[],"allergen_status":"unverified","seasonal_eligibility":"eligible","available":false,"maximum_quantity":0,"option_groups":[],"disclosures":[]},{"item_id":"e2071490-3974-4061-9ba0-c876b6211344","item_version":1,"category":"Filled Doughnuts","name":"Bavarian Creme","description":"Silky Bavarian creme, chocolate icing, and powdered sugar.","currency":"USD","shop_price_minor":160,"preorder_price_minor":null,"price_floor_minor":null,"media":[],"allergens":[],"allergen_status":"unverified","seasonal_eligibility":"eligible","available":false,"maximum_quantity":0,"option_groups":[],"disclosures":[]},{"item_id":"59c47986-8bed-4e65-a418-6fd31e193a03","item_version":1,"category":"Filled Doughnuts","name":"Blueberry Jam","description":"House-made blueberry jam rolled in granulated sugar.","currency":"USD","shop_price_minor":160,"preorder_price_minor":null,"price_floor_minor":null,"media":[],"allergens":[],"allergen_status":"unverified","seasonal_eligibility":"eligible","available":false,"maximum_quantity":0,"option_groups":[],"disclosures":[]},{"item_id":"4039041c-4030-4937-9792-f84d3cbe7f40","item_version":1,"category":"Filled Doughnuts","name":"Boston Creme","description":"Bavarian creme with signature chocolate icing.","currency":"USD","shop_price_minor":160,"preorder_price_minor":null,"price_floor_minor":null,"media":[],"allergens":[],"allergen_status":"unverified","seasonal_eligibility":"eligible","available":false,"maximum_quantity":0,"option_groups":[],"disclosures":[]},{"item_id":"b977695e-bcab-4e30-aea9-2020d0ded0d2","item_version":1,"category":"Filled Doughnuts","name":"Chocolate Iced Creme Filled","description":"Vanilla creme topped with chocolate icing.","currency":"USD","shop_price_minor":160,"preorder_price_minor":null,"price_floor_minor":null,"media":[],"allergens":[],"allergen_status":"unverified","seasonal_eligibility":"eligible","available":false,"maximum_quantity":0,"option_groups":[],"disclosures":[]},{"item_id":"bf93026a-a6e0-4d34-a15f-2ee9925e1db6","item_version":1,"category":"Filled Doughnuts","name":"Galactic Brownie Batter","description":"Fudge-filled with chocolate icing and candy-coated chocolate chips.","currency":"USD","shop_price_minor":160,"preorder_price_minor":null,"price_floor_minor":null,"media":[],"allergens":[],"allergen_status":"unverified","seasonal_eligibility":"eligible","available":false,"maximum_quantity":0,"option_groups":[],"disclosures":[]},{"item_id":"11f4a44f-e552-474d-8dcd-14b6622b8e87","item_version":1,"category":"Filled Doughnuts","name":"Powdered Vanilla Creme","description":"Powdered sugar with classic vanilla creme.","currency":"USD","shop_price_minor":160,"preorder_price_minor":null,"price_floor_minor":null,"media":[],"allergens":[],"allergen_status":"unverified","seasonal_eligibility":"eligible","available":false,"maximum_quantity":0,"option_groups":[],"disclosures":[]},{"item_id":"891db0ca-1908-40b4-b98a-b0854ae0160c","item_version":1,"category":"Iced Doughnuts","name":"Chocolate Iced Doughnut","description":"Chocolate icing with a velvety finish.","currency":"USD","shop_price_minor":160,"preorder_price_minor":null,"price_floor_minor":null,"media":[],"allergens":[],"allergen_status":"unverified","seasonal_eligibility":"eligible","available":false,"maximum_quantity":0,"option_groups":[],"disclosures":[]},{"item_id":"1347d6e0-6f98-4a79-a57c-a1991cb2542f","item_version":1,"category":"Iced Doughnuts","name":"Chocolate Iced Doughnut w/Sprinkles","description":"Chocolate icing with colorful sprinkles.","currency":"USD","shop_price_minor":160,"preorder_price_minor":null,"price_floor_minor":null,"media":[],"allergens":[],"allergen_status":"unverified","seasonal_eligibility":"eligible","available":false,"maximum_quantity":0,"option_groups":[],"disclosures":[]},{"item_id":"7f9abfd6-f28b-47c5-bd69-55001ab55d9c","item_version":1,"category":"Iced Doughnuts","name":"Strawberry Iced Doughnut","description":"Sweet strawberry icing.","currency":"USD","shop_price_minor":160,"preorder_price_minor":null,"price_floor_minor":null,"media":[],"allergens":[],"allergen_status":"unverified","seasonal_eligibility":"eligible","available":false,"maximum_quantity":0,"option_groups":[],"disclosures":[]},{"item_id":"f6e246e2-6835-404d-bbf2-6659d7bec46a","item_version":1,"category":"Iced Doughnuts","name":"Strawberry Iced Doughnut w/Sprinkles","description":"Strawberry icing with rainbow sprinkles.","currency":"USD","shop_price_minor":160,"preorder_price_minor":null,"price_floor_minor":null,"media":[],"allergens":[],"allergen_status":"unverified","seasonal_eligibility":"eligible","available":false,"maximum_quantity":0,"option_groups":[],"disclosures":[]},{"item_id":"63990cc7-7895-453f-abb2-a48c01a9cd7d","item_version":1,"category":"Iced Doughnuts","name":"Vanilla Iced","description":"Smooth vanilla icing.","currency":"USD","shop_price_minor":160,"preorder_price_minor":null,"price_floor_minor":null,"media":[],"allergens":[],"allergen_status":"unverified","seasonal_eligibility":"eligible","available":false,"maximum_quantity":0,"option_groups":[],"disclosures":[]},{"item_id":"8ae8090d-1171-42d5-a38c-6aaa88823bd6","item_version":1,"category":"Iced Doughnuts","name":"Vanilla Iced w/Sprinkles","description":"Vanilla icing with colorful sprinkles.","currency":"USD","shop_price_minor":160,"preorder_price_minor":null,"price_floor_minor":null,"media":[],"allergens":[],"allergen_status":"unverified","seasonal_eligibility":"eligible","available":false,"maximum_quantity":0,"option_groups":[],"disclosures":[]},{"item_id":"cc215bd3-12e4-4d74-9a0c-f409118a15db","item_version":1,"category":"Pastries","name":"Apple Ugly (Fritter)","description":"Craggy apple fritter.","currency":"USD","shop_price_minor":350,"preorder_price_minor":null,"price_floor_minor":null,"media":[],"allergens":[],"allergen_status":"unverified","seasonal_eligibility":"eligible","available":false,"maximum_quantity":0,"option_groups":[],"disclosures":[]},{"item_id":"66ae70ac-847a-4df9-b931-3823597a4070","item_version":1,"category":"Seasonal Special","name":"Seasonal Special","description":"Reserves the current seasonal special on the pickup date; flavor is not selected in advance.","currency":"USD","shop_price_minor":160,"preorder_price_minor":null,"price_floor_minor":null,"media":[],"allergens":[],"allergen_status":"unverified","seasonal_eligibility":"ineligible","available":false,"maximum_quantity":0,"option_groups":[],"disclosures":["Do not enable until a dated announced flavor is configured."]},{"item_id":"7c2198b1-d7db-4f27-85d8-400c063201b9","item_version":1,"category":"Sugared and Glazed","name":"Cinnamon Sugar","description":"Rolled in cinnamon sugar.","currency":"USD","shop_price_minor":160,"preorder_price_minor":null,"price_floor_minor":null,"media":[],"allergens":[],"allergen_status":"unverified","seasonal_eligibility":"eligible","available":false,"maximum_quantity":0,"option_groups":[],"disclosures":[]},{"item_id":"7b5ed98d-8e86-45a5-8a97-8943d9940a0d","item_version":1,"category":"Sugared and Glazed","name":"Glazed Doughnut","description":"Golden-fried with a smooth sweet glaze.","currency":"USD","shop_price_minor":160,"preorder_price_minor":null,"price_floor_minor":null,"media":[],"allergens":[],"allergen_status":"unverified","seasonal_eligibility":"eligible","available":false,"maximum_quantity":0,"option_groups":[],"disclosures":[]},{"item_id":"6bf7cdbd-1824-4743-ab11-31197844a6c2","item_version":1,"category":"Sugared and Glazed","name":"Honey Bun","description":"Glazed honey bun.","currency":"USD","shop_price_minor":160,"preorder_price_minor":null,"price_floor_minor":null,"media":[],"allergens":[],"allergen_status":"unverified","seasonal_eligibility":"eligible","available":false,"maximum_quantity":0,"option_groups":[],"disclosures":[]},{"item_id":"23a23ac5-ae72-4e15-a7c3-f6f4b37008e0","item_version":1,"category":"Sugared and Glazed","name":"Sugared","description":"Coated in granulated sugar.","currency":"USD","shop_price_minor":160,"preorder_price_minor":null,"price_floor_minor":null,"media":[],"allergens":[],"allergen_status":"unverified","seasonal_eligibility":"eligible","available":false,"maximum_quantity":0,"option_groups":[],"disclosures":[]}]}
